{
  "overall_score": 92,
  "timestamp": "2026-02-05T10:30:00Z",
  "summary": "PASS",
  "checks": {
    "content": {"status":"PASS","score":92,"details":{"key_decisions_present":true,"speaker_notes_coverage":100}},
    "design": {"status":"PASS","score":95,"details":{"token_compliance":true}},
    "accessibility": {"status":"PASS","score":90,"details":{"critical_violations":0}},
    "performance": {"status":"PASS","score":88,"details":{"total_assets_mb":4.2}},
    "technical": {"status":"PASS","score":90,"details":{}}
  },
  "issues": [
    {
      "id": "ISSUE-001",
      "slide": 10,
      "severity": "major",
      "category": "design",
      "title": "Chart uses non-design color",
      "description": "Chart on slide 10 uses a custom hex color not present in chart_palette",
      "location": "slide 10 > chart",
      "suggested_fix": "Map series color to design-spec.chart_palette.primary or accent1"
    }
  ],
  "warnings": ["Slide 28: large mermaid diagram may require simplification for 30min slot"],
  "fix_suggestions": [
    {"slide": 10, "suggestion": "Replace custom color with token 'primary'", "priority": "medium"}
  ]
}